Position,"Track Name",Artist,Streams,URL
1,"One Dance",Drake,1676,https://open.spotify.com/track/1xznGGDReH1oQq0xzbwXa3
2,"This Is What You Came For","Calvin Harris",1335,https://open.spotify.com/track/0azC730Exh71aQlOt9Zj3y
3,"Don't Let Me Down","The Chainsmokers",1130,https://open.spotify.com/track/1i1fxkWeaMmKEB4T7zqbzK
4,"This One's For You (feat. Zara Larsson) - Official Song UEFA EURO 2016","David Guetta",1129,https://open.spotify.com/track/46NBoIAHrmR7qcUGCIFEjR
5,"CAN'T STOP THE FEELING! (Original Song from DreamWorks Animation's ""TROLLS"")","Justin Timberlake",1053,https://open.spotify.com/track/6JV2JOEocMgcZxYSZelKcc
6,Panda,Desiigner,1045,https://open.spotify.com/track/5OOkp4U9P9oL23maHFHL1h
