Position,"Track Name",Artist,Streams,URL
1,"One Dance",Drake,1674,https://open.spotify.com/track/1xznGGDReH1oQq0xzbwXa3
2,"This Is What You Came For","Calvin Harris",1299,https://open.spotify.com/track/0azC730Exh71aQlOt9Zj3y
3,"Don't Let Me Down","The Chainsmokers",1145,https://open.spotify.com/track/1i1fxkWeaMmKEB4T7zqbzK
4,"CAN'T STOP THE FEELING! (Original Song from DreamWorks Animation's ""TROLLS"")","Justin Timberlake",1100,https://open.spotify.com/track/6JV2JOEocMgcZxYSZelKcc
5,"This One's For You (feat. Zara Larsson) - Official Song UEFA EURO 2016","David Guetta",1099,https://open.spotify.com/track/46NBoIAHrmR7qcUGCIFEjR
6,"Cheap Thrills",Sia,1082,https://open.spotify.com/track/27SdWb2rFzO6GWiYDBTD9j
