Position,"Track Name",Artist,Streams,URL
1,"One Dance",Drake,1591,https://open.spotify.com/track/1xznGGDReH1oQq0xzbwXa3
2,"This Is What You Came For","Calvin Harris",1226,https://open.spotify.com/track/0azC730Exh71aQlOt9Zj3y
3,"CAN'T STOP THE FEELING! (Original Song from DreamWorks Animation's ""TROLLS"")","Justin Timberlake",1110,https://open.spotify.com/track/6JV2JOEocMgcZxYSZelKcc
4,Panda,Desiigner,1092,https://open.spotify.com/track/275a9yzwGB6ncAW4SxY7q3
5,"Don't Let Me Down","The Chainsmokers",1087,https://open.spotify.com/track/1i1fxkWeaMmKEB4T7zqbzK
6,"This One's For You (feat. Zara Larsson) - Official Song UEFA EURO 2016","David Guetta",1022,https://open.spotify.com/track/46NBoIAHrmR7qcUGCIFEjR
