Position,"Track Name",Artist,Streams,URL
1,"One Dance",Drake,1694,https://open.spotify.com/track/1xznGGDReH1oQq0xzbwXa3
2,"This Is What You Came For","Calvin Harris",1142,https://open.spotify.com/track/0azC730Exh71aQlOt9Zj3y
3,Panda,Desiigner,1119,https://open.spotify.com/track/275a9yzwGB6ncAW4SxY7q3
4,"CAN'T STOP THE FEELING! (Original Song from DreamWorks Animation's ""TROLLS"")","Justin Timberlake",1049,https://open.spotify.com/track/6JV2JOEocMgcZxYSZelKcc
5,"This One's For You (feat. Zara Larsson) - Official Song UEFA EURO 2016","David Guetta",1040,https://open.spotify.com/track/46NBoIAHrmR7qcUGCIFEjR
6,"Don't Let Me Down","The Chainsmokers",1026,https://open.spotify.com/track/1i1fxkWeaMmKEB4T7zqbzK
